{
  "schema_version": "1.0.0",
  "producer_plugin": "maya-design",
  "producer_version": "0.1.0",
  "artifact_id": "maya_playblast_xyz789",
  "path": "/tmp/fixtures/maya_playblast.mp4",
  "sha256": "1111111111111111111111111111111111111111111111111111111111111111",
  "codec": "h264",
  "container": "mp4",
  "dimensions": {"width": 1920, "height": 1080},
  "fps": 30.0,
  "duration_seconds": 3.0,
  "bytes": 1048576,
  "camera": {"name": "perspShape"},
  "frame_range": {"start": 1, "end": 90},
  "preview_mode": "local_video",
  "restoration": {"status": "confirmed", "evidence": "playblast_settings_restored"}
}